{
  "schema_version": "1",
  "artifact_type": "telemetry_sample",
  "sample_id": "aaaaaaaaaaaaaaaaaaaaaaaaaaaaaaaaaaaaaaaaaaaaaaaaaaaaaaaaaaaaaaaa",
  "project_pseudonym": "bbbbbbbbbbbbbbbbbbbbbbbbbbbbbbbbbbbbbbbbbbbbbbbbbbbbbbbbbbbbbbbb",
  "issue": 14,
  "round": 1,
  "manifest_revision": 1,
  "attempt": 1,
  "role": "verification",
  "task_class": "workflow",
  "tier": "standard",
  "model": "gpt-5.6-terra",
  "effort": "low",
  "base_sha": "1111111111111111111111111111111111111111",
  "head_sha": "cccccccccccccccccccccccccccccccccccccccc",
  "transport": "cmux",
  "started_at": "2026-07-21T00:00:00Z",
  "ended_at": "2026-07-21T00:02:00Z",
  "duration_ms": 120000,
  "terminal": "green",
  "retry_of": "",
  "closure": {
    "source": ".review/ISSUE-14-CLOSURE.json",
    "sha256": "dddddddddddddddddddddddddddddddddddddddddddddddddddddddddddddddd",
    "value": {
      "schema_version": "1",
      "artifact_type": "candidate_closure",
      "producer_role": "CONDUCTOR",
      "issue": 14,
      "round": 1,
      "manifest_revision": 1,
      "plan_revision": 1,
      "candidate_head": "cccccccccccccccccccccccccccccccccccccccc",
      "attempt_id": "attempt-1",
      "integration_sha256": "eeeeeeeeeeeeeeeeeeeeeeeeeeeeeeeeeeeeeeeeeeeeeeeeeeeeeeeeeeeeeeee",
      "evidence_set_sha256": "ffffffffffffffffffffffffffffffffffffffffffffffffffffffffffffffff",
      "status": "closed",
      "reason_codes": [],
      "evaluated_at": "2026-07-21T00:02:00Z"
    }
  },
  "artifacts": [
    { "kind": "round_state", "path": ".review/ISSUE-14-ROUND-STATE.json", "sha256": "1111111111111111111111111111111111111111111111111111111111111111" },
    { "kind": "run", "path": ".review/ISSUE-14-RUN.json", "sha256": "2222222222222222222222222222222222222222222222222222222222222222" },
    { "kind": "candidate_closure", "path": ".review/ISSUE-14-CLOSURE.json", "sha256": "dddddddddddddddddddddddddddddddddddddddddddddddddddddddddddddddd" },
    { "kind": "integration", "path": ".review/ISSUE-14-INTEGRATION.json", "sha256": "eeeeeeeeeeeeeeeeeeeeeeeeeeeeeeeeeeeeeeeeeeeeeeeeeeeeeeeeeeeeeeee" },
    { "kind": "candidate_evidence", "path": ".review/ISSUE-14-CANDIDATE-EVIDENCE.json", "sha256": "ffffffffffffffffffffffffffffffffffffffffffffffffffffffffffffffff" }
  ],
  "usage": {
    "kind": "unavailable",
    "input_tokens": null,
    "output_tokens": null,
    "cost": null,
    "currency": null,
    "source": null,
    "provenance_version": null
  }
}
